{
  "name": "detector-example",
  "role": "detector",
  "artifact": "detector.onnx",
  "sha256": "0000000000000000000000000000000000000000000000000000000000000000",
  "backend": "onnxruntime",
  "input": {
    "name": "images",
    "shape": [1, 3, 640, 640],
    "dtype": "float32"
  },
  "outputs": [
    {
      "name": "output0"
    }
  ],
  "class_names": [
    "Person",
    "Vehicle-Wheeled",
    "Vehicle-Tracked",
    "Aircraft-Rotary",
    "Aircraft-Fixed",
    "Watercraft",
    "Structure-Temp"
  ],
  "preprocessing": {
    "scale": 0.00392156862745098,
    "color_order": "BGR"
  },
  "export": {
    "source": "placeholder"
  }
}
